query,doc,score
Where is the Eiffel Tower located?,The Green Bay Packers play at Lambeau Field.,0.2296503484249115
Where is the Eiffel Tower located?,"The New York Yankees are based in the Bronx, New York City.",0.1485341340303421
Where is the Eiffel Tower located?,Russia hosted the 2018 FIFA World Cup.,0.0793524980545044
Who wrote Hamlet?,Carlos Alcaraz won the 2023 Wimbledon Men's Singles title.,0.18646393716335297
Who wrote Hamlet?,"In hockey and soccer, a 'hat trick' refers to a player scoring three goals in a single game.",0.1165183037519455
Who wrote Hamlet?,The Green Bay Packers play at Lambeau Field.,0.06935164332389832
